{
  "schema_version": "1.0",
  "commit": "e3a1eda0965e545d96467d275bccaf78c890fcac",
  "configuration_id": "cc-default",
  "edges": [
    [
      "main.o",
      "include/config.h"
    ],
    [
      "main.o",
      "include/parser.h"
    ],
    [
      "main.o",
      "src/main.c"
    ],
    [
      "parser.o",
      "include/parser.h"
    ],
    [
      "parser.o",
      "src/parser.c"
    ],
    [
      "token.o",
      "include/token.h"
    ],
    [
      "token.o",
      "src/token.c"
    ],
    [
      "util.o",
      "include/legacy.h"
    ],
    [
      "util.o",
      "include/util.h"
    ],
    [
      "util.o",
      "src/util.c"
    ]
  ]
}
